{"$schema":"https://json-schema.org/draft/2020-12/schema","additionalProperties":false,"properties":{"binding_policy":{"minLength":1,"type":"string"},"candidate_id":{"minLength":1,"type":"string"},"candidate_version":{"minLength":1,"type":"string"},"checks":{"items":{"additionalProperties":false,"properties":{"check_id":{"minLength":1,"type":"string"},"evidence":{"minLength":1,"type":"string"},"status":{"enum":["passed","failed","blocked","not_applicable"],"type":"string"}},"required":["check_id","status","evidence"],"type":"object"},"minItems":1,"type":"array"},"closed_findings":{"items":{"minLength":1,"type":"string"},"type":"array","uniqueItems":true},"counterfactuals":{"items":{"minLength":1,"type":"string"},"minItems":1,"type":"array"},"falsification_conditions":{"items":{"minLength":1,"type":"string"},"minItems":1,"type":"array"},"finding_resolutions":{"items":{"additionalProperties":false,"properties":{"authority_id":{"type":["string","null"]},"evidence_path":{"minLength":1,"type":"string"},"finding_id":{"minLength":1,"type":"string"},"rationale":{"minLength":1,"type":"string"},"status":{"enum":["VERIFIED_CLOSED","NOT_APPLICABLE_VERIFIED","WAIVED_BY_AUTHORITY"]}},"required":["finding_id","status","rationale","evidence_path","authority_id"],"type":"object"},"type":"array"},"go_recommended":{"type":"boolean"},"governing_constraints":{"items":{"minLength":1,"type":"string"},"minItems":1,"type":"array"},"open_findings":{"items":{"minLength":1,"type":"string"},"type":"array","uniqueItems":true},"record_scope":{"const":"source_template"},"review_id":{"minLength":1,"type":"string"},"review_scope":{"minLength":1,"type":"string"},"reviewer_class":{"enum":["independent_bundle_reviewer","project_owner","designated_reviewer","self_review"]},"schema_version":{"const":"3.1"},"verdict":{"enum":["FEEDBACK_REQUIRED","GO_RECOMMENDED","HOLD"]},"verdict_reason":{"minLength":1,"type":"string"}},"required":["schema_version","record_scope","review_id","candidate_version","reviewer_class","review_scope","governing_constraints","checks","closed_findings","open_findings","counterfactuals","falsification_conditions","verdict","verdict_reason","go_recommended","binding_policy","finding_resolutions"],"title":"Review Source Template","type":"object"}
